Item,Frequency,Support
WHITE HANGING HEART T-LIGHT HOLDER,4651,0.151
REGENCY CAKESTAND 3 TIER,2809,0.0912
ASSORTED COLOUR BIRD ORNAMENT,2493,0.081
JUMBO BAG RED RETROSPOT,2366,0.0768
PARTY BUNTING,1917,0.0623
LUNCH BAG  BLACK SKULL.,1899,0.0617
REX CASH+CARRY JUMBO SHOPPER,1823,0.0592
HOME BUILDING BLOCK WORD,1763,0.0573
HEART OF WICKER SMALL,1720,0.0559
HEART OF WICKER LARGE,1717,0.0558
WOODEN FRAME ANTIQUE WHITE,1715,0.0557
LUNCH BAG SPACEBOY DESIGN,1679,0.0545
STRAWBERRY CERAMIC TRINKET BOX,1651,0.0536
LUNCH BAG CARS BLUE,1630,0.0529
PAPER CHAIN KIT 50'S CHRISTMAS,1618,0.0525
JUMBO STORAGE BAG SUKI,1613,0.0524
WOODEN PICTURE FRAME WHITE FINISH,1605,0.0521
JUMBO SHOPPER VINTAGE RED PAISLEY,1598,0.0519
60 TEATIME FAIRY CAKE CASES,1584,0.0514
NATURAL SLATE HEART CHALKBOARD,1570,0.051
RED HANGING HEART T-LIGHT HOLDER,1546,0.0502
BAKING SET 9 PIECE RETROSPOT,1470,0.0477
JUMBO BAG STRAWBERRY,1444,0.0469
LOVE BUILDING BLOCK WORD,1442,0.0468
PACK OF 60 PINK PAISLEY CAKE CASES,1401,0.0455
JUMBO  BAG BAROQUE BLACK WHITE,1396,0.0453
VINTAGE SNAP CARDS,1395,0.0453
VICTORIAN GLASS HANGING T-LIGHT,1381,0.0448
SCOTTIE DOG HOT WATER BOTTLE,1375,0.0447
CHOCOLATE HOT WATER BOTTLE,1374,0.0446
LUNCH BAG RED RETROSPOT,1337,0.0434
GIN + TONIC DIET METAL SIGN,1334,0.0433
LUNCH BAG WOODLAND,1329,0.0432
PLEASE ONE PERSON METAL SIGN,1328,0.0431
HAND OVER THE CHOCOLATE   SIGN,1264,0.041
HOT WATER BOTTLE TEA AND SYMPATHY,1218,0.0396
ZINC METAL HEART DECORATION,1196,0.0388
6 RIBBONS RUSTIC CHARM,1184,0.0384
PAPER CHAIN KIT VINTAGE CHRISTMAS,1180,0.0383
PINK CREAM FELT CRAFT TRINKET BOX,1171,0.038
RECIPE BOX PANTRY YELLOW DESIGN,1147,0.0372
COOK WITH WINE METAL SIGN,1143,0.0371
FELTCRAFT 6 FLOWER FRIENDS,1126,0.0366
JUMBO BAG PINK VINTAGE PAISLEY,1122,0.0364
PACK OF 72 RETROSPOT CAKE CASES,1116,0.0362
SWEETHEART CERAMIC TRINKET BOX,1095,0.0356
VINTAGE UNION JACK BUNTING,1085,0.0352
CREAM HEART CARD HOLDER,1082,0.0351
HANGING HEART ZINC T-LIGHT HOLDER,1073,0.0348
72 SWEETHEART FAIRY CAKE CASES,1058,0.0344
COLOUR GLASS T-LIGHT HOLDER HANGING,1049,0.0341
PACK OF 72 SKULL CAKE CASES,1040,0.0338
WOOD 2 DRAWER CABINET WHITE FINISH,1037,0.0337
BATHROOM METAL SIGN,1033,0.0335
HANGING HEART JAR T-LIGHT HOLDER,1024,0.0333
HAND WARMER OWL DESIGN,1012,0.0329
LUNCH BAG PINK POLKADOT,1011,0.0328
PACK OF 60 DINOSAUR CAKE CASES,1007,0.0327
ALARM CLOCK BAKELIKE RED,1000,0.0325
SET OF 3 CAKE TINS PANTRY DESIGN,999,0.0324
PACK OF 72 RETRO SPOT CAKE CASES,997,0.0324
WOOD BLACK BOARD ANT WHITE FINISH,991,0.0322
FELTCRAFT BUTTERFLY HEARTS,985,0.032
JUMBO BAG PINK POLKADOT,985,0.032
WOOD S/3 CABINET ANT WHITE FINISH,978,0.0318
LUNCH BAG SUKI  DESIGN,973,0.0316
RETROSPOT TEA SET CERAMIC 11 PC,972,0.0316
JUMBO STORAGE BAG SKULLS,958,0.0311
LUNCH BAG RED SPOTTY,947,0.0308
NO SINGING METAL SIGN,937,0.0304
PINK BLUE FELT CRAFT TRINKET BOX,936,0.0304
VINTAGE HEADS AND TAILS CARD GAME,935,0.0304
RECYCLING BAG RETROSPOT,921,0.0299
SMALL POPCORN HOLDER,920,0.0299
ROSES REGENCY TEACUP AND SAUCER,917,0.0298
HAND WARMER SCOTTY DOG DESIGN,915,0.0297
ALARM CLOCK BAKELIKE GREEN,913,0.0296
SET/5 RED RETROSPOT LID GLASS BOWLS,912,0.0296
RED WOOLLY HOTTIE WHITE HEART.,907,0.0295
SPOTTY BUNTING,905,0.0294
IVORY KITCHEN SCALES,903,0.0293
CLOTHES PEGS RETROSPOT PACK 24,888,0.0288
STRAWBERRY CHARLOTTE BAG,885,0.0287
HAND WARMER BIRD DESIGN,881,0.0286
GREY HEART HOT WATER BOTTLE,868,0.0282
PLASTERS IN TIN SPACEBOY,863,0.028
JUMBO BAG SPACEBOY DESIGN,860,0.0279
LADIES & GENTLEMEN METAL SIGN,855,0.0278
PLASTERS IN TIN VINTAGE PAISLEY,855,0.0278
CHILLI LIGHTS,854,0.0277
SET OF 3 HEART COOKIE CUTTERS,849,0.0276
PACK OF 6 BIRDY GIFT TAGS,843,0.0274
POTTERING IN THE SHED METAL SIGN,839,0.0272
WORLD WAR 2 GLIDERS ASSTD DESIGNS,838,0.0272
JUMBO BAG OWLS,838,0.0272
LUNCH BAG SUKI DESIGN,836,0.0271
GREEN REGENCY TEACUP AND SAUCER,827,0.0269
RED RETROSPOT CAKE STAND,825,0.0268
CHARLOTTE BAG SUKI DESIGN,819,0.0266
SET OF 20 VINTAGE CHRISTMAS NAPKINS,812,0.0264
DOORMAT HEARTS,811,0.0263
DOORMAT UNION FLAG,810,0.0263
HOT BATHS METAL SIGN,800,0.026
PLASTERS IN TIN SKULLS,795,0.0258
SPACEBOY LUNCH BOX,794,0.0258
SET OF 4 PANTRY JELLY MOULDS,792,0.0257
WOODEN BOX OF DOMINOES,790,0.0257
3 STRIPEY MICE FELTCRAFT,779,0.0253
HAND WARMER UNION JACK,778,0.0253
PARTY METAL SIGN,774,0.0251
HOT WATER BOTTLE I AM SO POORLY,772,0.0251
JAM MAKING SET WITH JARS,771,0.025
CREAM SWEETHEART MINI CHEST,771,0.025
EDWARDIAN PARASOL NATURAL,765,0.0248
SINGLE HEART ZINC T-LIGHT HOLDER,765,0.0248
LUNCH BAG DOLLY GIRL DESIGN,765,0.0248
HANGING JAM JAR T-LIGHT HOLDER,760,0.0247
RIBBON REEL STRIPES DESIGN,759,0.0246
DOLLY GIRL LUNCH BOX,758,0.0246
GRAND CHOCOLATECANDLE,758,0.0246
ANTIQUE SILVER TEA GLASS ETCHED,757,0.0246
PLASTERS IN TIN CIRCUS PARADE,757,0.0246
BAKING SET SPACEBOY DESIGN,754,0.0245
RED RETROSPOT CHARLOTTE BAG,752,0.0244
PLASTERS IN TIN WOODLAND ANIMALS,751,0.0244
PACK OF 60 SPACEBOY CAKE CASES,751,0.0244
GUMBALL COAT RACK,749,0.0243
RETROSPOT HEART HOT WATER BOTTLE,749,0.0243
CHOCOLATE THIS WAY METAL SIGN,747,0.0243
WOODLAND CHARLOTTE BAG,745,0.0242
LUNCH BAG APPLE DESIGN,745,0.0242
GARDENERS KNEELING PAD KEEP CALM,741,0.0241
JAM MAKING SET PRINTED,740,0.024
KNITTED UNION FLAG HOT WATER BOTTLE,739,0.024
WOODEN SCHOOL COLOURING SET,739,0.024
WHITE WOOD GARDEN PLANT LADDER,736,0.0239
BEWARE OF THE CAT METAL SIGN,736,0.0239
60 CAKE CASES VINTAGE CHRISTMAS,730,0.0237
FELTCRAFT CUSHION OWL,729,0.0237
SET/20 RED RETROSPOT PAPER NAPKINS,726,0.0236
PINK HAPPY BIRTHDAY BUNTING,723,0.0235
SET OF 3 BUTTERFLY COOKIE CUTTERS,721,0.0234
HEART IVORY TRELLIS LARGE,712,0.0231
RED  HARMONICA IN BOX,712,0.0231
JUMBO BAG VINTAGE LEAF,709,0.023
POTTING SHED TEA MUG,707,0.023
TOILET METAL SIGN,707,0.023
WHITE SKULL HOT WATER BOTTLE,705,0.0229
JUMBO BAG WOODLAND ANIMALS,705,0.0229
WICKER STAR,705,0.0229
PACK OF 12 HEARTS DESIGN TISSUES,702,0.0228
LOVEBIRD HANGING DECORATION WHITE,702,0.0228
SET/20 RED SPOTTY PAPER NAPKINS,698,0.0227
JUMBO BAG ALPHABET,694,0.0225
SET/5 RED SPOTTY LID GLASS BOWLS,694,0.0225
PAPER CHAIN KIT EMPIRE,693,0.0225
HOT WATER BOTTLE KEEP CALM,689,0.0224
FAWN BLUE HOT WATER BOTTLE,689,0.0224
METAL SIGN TAKE IT OR LEAVE IT,687,0.0223
SMALL GLASS HEART TRINKET POT,687,0.0223
DOORMAT NEW ENGLAND,683,0.0222
HEART FILIGREE DOVE  SMALL,680,0.0221
CREAM CUPID HEARTS COAT HANGER,679,0.022
PAINTED METAL PEARS ASSORTED,679,0.022
WOODEN HEART CHRISTMAS SCANDINAVIAN,679,0.022
BLUE HARMONICA IN BOX,679,0.022
AREA PATROLLED METAL SIGN,674,0.0219
LUNCH BAG PINK RETROSPOT,672,0.0218
EDWARDIAN PARASOL BLACK,672,0.0218
JUMBO BAG SCANDINAVIAN PAISLEY,672,0.0218
METAL 4 HOOK HANGER FRENCH CHATEAU,671,0.0218
TRADITIONAL KNITTING NANCY,663,0.0215
LUNCH BOX I LOVE LONDON,663,0.0215
I'M ON HOLIDAY METAL SIGN,662,0.0215
DOORMAT RED RETROSPOT,662,0.0215
MEMO BOARD RETROSPOT  DESIGN,661,0.0215
RED TOADSTOOL LED NIGHT LIGHT,661,0.0215
PLASTERS IN TIN STRONGMAN,658,0.0214
PINK REGENCY TEACUP AND SAUCER,658,0.0214
ROUND SNACK BOXES SET OF 4 FRUITS,657,0.0213
BOX OF 24 COCKTAIL PARASOLS,656,0.0213
JUMBO BAG PINK WITH WHITE SPOTS,653,0.0212
RED RETROSPOT SMALL MILK JUG,652,0.0212
12 PENCILS SMALL TUBE SKULL,652,0.0212
FELTCRAFT CUSHION BUTTERFLY,650,0.0211
FELTCRAFT CUSHION RABBIT,648,0.021
ENAMEL FLOWER JUG CREAM,648,0.021
RED GINGHAM ROSE JEWELLERY BOX,647,0.021
"KEY FOB , SHED",647,0.021
HAND WARMER RED RETROSPOT,645,0.0209
ROUND SNACK BOXES SET OF4 WOODLAND,638,0.0207
SPACEBOY BIRTHDAY CARD,637,0.0207
WASHROOM METAL SIGN,637,0.0207
RED KITCHEN SCALES,637,0.0207
ALARM CLOCK BAKELIKE PINK,631,0.0205
NATURAL SLATE RECTANGLE CHALKBOARD,629,0.0204
CERAMIC STRAWBERRY CAKE MONEY BANK,628,0.0204
GARDENERS KNEELING PAD CUP OF TEA,626,0.0203
JUMBO BAG APPLES,626,0.0203
FELTCRAFT DOLL MOLLY,626,0.0203
JUMBO BAG TOYS,625,0.0203
HEART IVORY TRELLIS SMALL,624,0.0203
RABBIT NIGHT LIGHT,624,0.0203
WOODEN UNION JACK BUNTING,623,0.0202
TEA TIME PARTY BUNTING,623,0.0202
3 HEARTS HANGING DECORATION RUSTIC,620,0.0201
HANGING METAL HEART LANTERN,620,0.0201
TRAVEL SEWING KIT,620,0.0201
CHICK GREY HOT WATER BOTTLE,617,0.02
FELTCRAFT DOLL ROSIE,616,0.02
PINK FAIRY CAKE CHILDRENS APRON,615,0.02
PAPER BUNTING WHITE LACE,614,0.0199
WOODEN STAR CHRISTMAS SCANDINAVIAN,612,0.0199
WOODEN ROUNDERS GARDEN SET,612,0.0199
COLOUR GLASS. STAR T-LIGHT HOLDER,607,0.0197
DOOR MAT UNION FLAG,605,0.0196
SCANDINAVIAN REDS RIBBONS,605,0.0196
DOORMAT KEEP CALM AND COME IN,604,0.0196
RETRO SPOT TEA SET CERAMIC 11 PC,601,0.0195
HEART FILIGREE DOVE LARGE,601,0.0195
CHILDRENS APRON SPACEBOY DESIGN,601,0.0195
PLACE SETTING WHITE HEART,600,0.0195
HOME SWEET HOME MUG,597,0.0194
LUNCH BAG ALPHABET DESIGN,594,0.0193
TRADITIONAL MODELLING CLAY,594,0.0193
TRADITIONAL WOODEN SKIPPING ROPE,594,0.0193
SET OF 6 SPICE TINS PANTRY DESIGN,591,0.0192
STRAWBERRY LUNCH BOX WITH CUTLERY,590,0.0192
ASSORTED COLOUR MINI CASES,589,0.0191
SILVER HANGING T-LIGHT HOLDER,588,0.0191
PACK OF 12 LONDON TISSUES,587,0.0191
YOU'RE CONFUSING ME METAL SIGN,584,0.019
RED RETROSPOT PICNIC BAG,579,0.0188
ASSORTED COLOURS SILK FAN,578,0.0188
BLUE STRIPE CERAMIC DRAWER KNOB,575,0.0187
FELTCRAFT PRINCESS CHARLOTTE DOLL,573,0.0186
SET OF 3 REGENCY CAKE TINS,570,0.0185
SMALL WHITE HEART OF WICKER,568,0.0184
"KEY FOB , BACK DOOR",568,0.0184
SWALLOWS GREETING CARD,567,0.0184
PACK OF 20 NAPKINS PANTRY DESIGN,566,0.0184
NATURAL SLATE CHALKBOARD LARGE,566,0.0184
POPCORN HOLDER,566,0.0184
WHITE METAL LANTERN,565,0.0183
JUMBO BAG VINTAGE DOILY,565,0.0183
HOME SWEET HOME METAL SIGN,561,0.0182
RECIPE BOX RETROSPOT,559,0.0182
FOUR HOOK  WHITE LOVEBIRDS,555,0.018
ALARM CLOCK BAKELIKE IVORY,555,0.018
PAPER BUNTING RETROSPOT,554,0.018
DOORMAT SPOTTY HOME SWEET HOME,553,0.018
PAPER CHAIN KIT RETROSPOT,553,0.018
BINGO SET,553,0.018
SET OF 3 NOTEBOOKS IN PARCEL,553,0.018
VINTAGE SNAKES & LADDERS,551,0.0179
LUNCH BAG VINTAGE LEAF DESIGN,550,0.0179
DOORSTOP RETROSPOT HEART,549,0.0178
SET OF 36 TEATIME PAPER DOILIES,548,0.0178
SAVE THE PLANET MUG,546,0.0177
TRADITIONAL WOODEN CATCH CUP GAME,546,0.0177
BLUE HAPPY BIRTHDAY BUNTING,543,0.0176
TEA TIME OVEN GLOVE,542,0.0176
FELTCRAFT PRINCESS LOLA DOLL,542,0.0176
PHOTO FRAME CORNICE,542,0.0176
JUMBO BAG 50'S CHRISTMAS,541,0.0176
MULTI COLOUR SILVER T-LIGHT HOLDER,540,0.0175
LAUNDRY 15C METAL SIGN,540,0.0175
ANTIQUE SILVER TEA GLASS ENGRAVED,532,0.0173
POPPY'S PLAYHOUSE KITCHEN,531,0.0172
PAPER BUNTING RETRO SPOTS,531,0.0172
PICNIC BASKET WICKER SMALL,530,0.0172
CERAMIC HEART FAIRY CAKE MONEY BANK,530,0.0172
SET OF 20 KIDS COOKIE CUTTERS,529,0.0172
RED STRIPE CERAMIC DRAWER KNOB,529,0.0172
PACK OF 60 MUSHROOM CAKE CASES,528,0.0171
GINGERBREAD MAN COOKIE CUTTER,527,0.0171
VINTAGE UNION JACK CUSHION COVER,527,0.0171
SMALL HEART MEASURING SPOONS,527,0.0171
FELTCRAFT DOLL EMILY,526,0.0171
BLUE SPOT CERAMIC DRAWER KNOB,524,0.017
TRADITIONAL CHRISTMAS RIBBONS,524,0.017
4 TRADITIONAL SPINNING TOPS,524,0.017
SET OF 6 RIBBONS VINTAGE CHRISTMAS,523,0.017
DOORMAT FANCY FONT HOME SWEET HOME,523,0.017
ENAMEL BREAD BIN CREAM,522,0.017
SET OF 72 PINK HEART PAPER DOILIES,522,0.017
KITCHEN METAL SIGN,521,0.0169
EDWARDIAN PARASOL RED,520,0.0169
ANTIQUE SILVER T-LIGHT GLASS,520,0.0169
FAMILY ALBUM WHITE PICTURE FRAME,517,0.0168
MEMO BOARD COTTAGE DESIGN,516,0.0168
WHITE SPOT RED CERAMIC DRAWER KNOB,515,0.0167
I CAN ONLY PLEASE ONE PERSON MUG,515,0.0167
SET 12 RETRO WHITE CHALK STICKS,513,0.0167
SET 12 KIDS COLOUR  CHALK STICKS,513,0.0167
HOMEMADE JAM SCENTED CANDLES,512,0.0166
AGED GLASS SILVER T-LIGHT HOLDER,512,0.0166
SET/6 RED SPOTTY PAPER PLATES,511,0.0166
PACK OF 12 TRADITIONAL CRAYONS,511,0.0166
VICTORIAN SEWING BOX SMALL,510,0.0166
CHARLOTTE BAG PINK POLKADOT,510,0.0166
OPEN CLOSED METAL SIGN,504,0.0164
"FANCY FONT BIRTHDAY CARD,",504,0.0164
ZINC FOLKART SLEIGH BELLS,504,0.0164
RED DINER WALL CLOCK,503,0.0163
SET OF 6 SOLDIER SKITTLES,503,0.0163
3 HOOK PHOTO SHELF ANTIQUE WHITE,501,0.0163
LARGE WHITE HEART OF WICKER,500,0.0162
PINK HEART SHAPE EGG FRYING PAN,499,0.0162
RED FLORAL FELTCRAFT SHOULDER BAG,499,0.0162
WOODEN CROQUET GARDEN SET,496,0.0161
SET 7 BABUSHKA NESTING BOXES,496,0.0161
FELTCRAFT CHRISTMAS FAIRY,496,0.0161
TEA PARTY BIRTHDAY CARD,495,0.0161
ENAMEL MEASURING JUG CREAM,495,0.0161
CHRISTMAS CRAFT LITTLE FRIENDS,494,0.016
WHITE SPOT BLUE CERAMIC DRAWER KNOB,493,0.016
CANDLEHOLDER PINK HANGING HEART,492,0.016
TOY TIDY SPACEBOY,491,0.0159
BATH BUILDING BLOCK WORD,491,0.0159
IVORY HANGING DECORATION  HEART,490,0.0159
RED SPOT CERAMIC DRAWER KNOB,490,0.0159
WOODEN HAPPY BIRTHDAY GARLAND,488,0.0158
RIBBON REEL HEARTS DESIGN,487,0.0158
SET/20 STRAWBERRY PAPER NAPKINS,486,0.0158
PACK 20 ENGLISH ROSE PAPER NAPKINS,486,0.0158
SET/3 RED GINGHAM ROSE STORAGE BOX,486,0.0158
SET OF 36 PAISLEY FLOWER DOILIES,483,0.0157
VINTAGE UNION JACK MEMOBOARD,483,0.0157
SMALL DOLLY MIX DESIGN ORANGE BOWL,483,0.0157
PACK OF 12 SUKI TISSUES,482,0.0157
LUNCH BAG VINTAGE DOILY,482,0.0157
JUMBO BAG DOLLY GIRL DESIGN,479,0.0156
ROTATING SILVER ANGELS T-LIGHT HLDR,479,0.0156
PICTURE FRAME WOOD TRIPLE PORTRAIT,478,0.0155
PINK FLORAL FELTCRAFT SHOULDER BAG,477,0.0155
BLACK RECORD COVER FRAME,477,0.0155
GINGHAM HEART  DOORSTOP RED,477,0.0155
BLACK HEART CARD HOLDER,474,0.0154
POPPY'S PLAYHOUSE BEDROOM,472,0.0153
12 PENCILS TALL TUBE SKULLS,471,0.0153
RED SPOTTY BISCUIT TIN,466,0.0151
RED SPOTTY CHARLOTTE BAG,466,0.0151
GLITTER BUTTERFLY CLIPS,465,0.0151
PICNIC BASKET WICKER LARGE,463,0.015
SET 2 TEA TOWELS I LOVE LONDON,462,0.015
FILIGRIS HEART WITH BUTTERFLY,462,0.015
AIRLINE BAG VINTAGE TOKYO 78,461,0.015
RECIPE BOX BLUE SKETCHBOOK DESIGN,461,0.015
RED RETROSPOT TRADITIONAL TEAPOT,460,0.0149
LARGE HEART MEASURING SPOONS,458,0.0149
STRAWBERRY SHOPPER BAG,457,0.0148
HAPPY STENCIL CRAFT,456,0.0148
BLUE DINER WALL CLOCK,454,0.0147
12 PENCIL SMALL TUBE WOODLAND,453,0.0147
HAND WARMER BABUSHKA DESIGN,453,0.0147
FANCY FONTS BIRTHDAY WRAP,452,0.0147
PAPER CHAIN KIT RETRO SPOT,450,0.0146
SCANDINAVIAN PAISLEY PICNIC BAG,450,0.0146
MINT KITCHEN SCALES,445,0.0145
STRAWBERRY   PICNIC BAG,445,0.0145
PICTURE DOMINOES,445,0.0145
PACK OF 6 PANNETONE GIFT BOXES,443,0.0144
GAOLERS KEYS DECORATIVE GARDEN,441,0.0143
BOX OF VINTAGE JIGSAW BLOCKS,441,0.0143
MINI PAINT SET VINTAGE,440,0.0143
BOX OF VINTAGE ALPHABET BLOCKS,438,0.0142
MANUAL,437,0.0142
SET/6 RED SPOTTY PAPER CUPS,437,0.0142
MINI CAKE STAND  HANGING STRAWBERY,437,0.0142
ALARM CLOCK BAKELIKE ORANGE,436,0.0142
PAPER BUNTING COLOURED LACE,436,0.0142
LUNCH BOX WITH CUTLERY RETROSPOT,436,0.0142
GARDENERS KNEELING PAD,435,0.0141
COWBOYS AND INDIANS BIRTHDAY CARD,434,0.0141
IVORY DINER WALL CLOCK,434,0.0141
SWEETHEART CAKESTAND 3 TIER,433,0.0141
PINK DOUGHNUT TRINKET POT,433,0.0141
FOOD CONTAINER SET 3 LOVE HEART,429,0.0139
TRAVEL CARD WALLET KEEP CALM,428,0.0139
LOVE HOT WATER BOTTLE,427,0.0139
BAG 250G SWIRLY MARBLES,426,0.0138
CHARLOTTE BAG DOLLY GIRL DESIGN,426,0.0138
BAG 125G SWIRLY MARBLES,425,0.0138
12 PENCILS SMALL TUBE RED RETROSPOT,424,0.0138
WATERING CAN BLUE ELEPHANT,424,0.0138
JUMBO BAG RED WHITE SPOTTY,423,0.0137
JUMBO BAG PEARS,423,0.0137
JUMBO BAG SCANDINAVIAN BLUE PAISLEY,423,0.0137
SET OF 60 PANTRY DESIGN CAKE CASES,423,0.0137
CERAMIC CHERRY CAKE MONEY BANK,422,0.0137
TEA TIME CAKE STAND IN GIFT BOX,421,0.0137
DOORMAT ENGLISH ROSE,419,0.0136
COLOURING PENCILS BROWN TUBE,419,0.0136
LAVENDER SCENTED FABRIC HEART,419,0.0136
RETROSPOT CHILDRENS APRON,418,0.0136
PINK VINTAGE PAISLEY PICNIC BAG,418,0.0136
SET 20 NAPKINS FAIRY CAKES DESIGN,418,0.0136
RED RETROSPOT SHOPPER BAG,417,0.0135
WOODEN TREE CHRISTMAS SCANDINAVIAN,415,0.0135
COFFEE MUG CAT + BIRD DESIGN,415,0.0135
GIN AND TONIC MUG,414,0.0134
RETRO SPOT LARGE MILK JUG,413,0.0134
SET/6 PINK  BUTTERFLY T-LIGHTS,413,0.0134
LUNCH BAG DOILEY PATTERN,412,0.0134
JUMBO BAG DOILEY PATTERNS,411,0.0133
RED RETROSPOT SUGAR JAM BOWL,410,0.0133
FIRST AID TIN,410,0.0133
ENCHANTED BIRD COATHANGER 5 HOOK,410,0.0133
CHRISTMAS CRAFT WHITE FAIRY,409,0.0133
HEART DECORATION WITH PEARLS,408,0.0132
ROMANTIC PINKS RIBBONS,408,0.0132
ROUND SNACK BOXES SET OF 4 SKULLS,407,0.0132
PIGGY BANK RETROSPOT,407,0.0132
CHRISTMAS CRAFT TREE TOP ANGEL,406,0.0132
60 CAKE CASES DOLLY GIRL DESIGN,405,0.0132
"KEY FOB , GARAGE DESIGN",401,0.013
"KEY FOB , FRONT  DOOR",401,0.013
ZINC WILLIE WINKIE  CANDLE STICK,401,0.013
SUKI  SHOULDER BAG,400,0.013
SKULL LUNCH BOX WITH CUTLERY,400,0.013
VINTAGE CREAM 3 BASKET CAKE STAND,399,0.013
15CM CHRISTMAS GLASS BALL 20 LIGHTS,399,0.013
10 COLOUR SPACEBOY PEN,397,0.0129
RED RETROSPOT PEG BAG,397,0.0129
GLITTER HANGING BUTTERFLY STRING,396,0.0129
POTTERING MUG,396,0.0129
CACTI T-LIGHT CANDLES,394,0.0128
CHOCOLATE BOX RIBBONS,393,0.0128
POPPY'S PLAYHOUSE LIVINGROOM,393,0.0128
ROBOT BIRTHDAY CARD,393,0.0128
DOORMAT WELCOME TO OUR HOME,392,0.0127
LARGE CAKE STAND  HANGING STRAWBERY,392,0.0127
CHARLIE + LOLA RED HOT WATER BOTTLE,391,0.0127
DOOR MAT NEW ENGLAND,389,0.0126
SMALL MARSHMALLOWS PINK BOWL,388,0.0126
ENGLISH ROSE NOTEBOOK A7 SIZE,386,0.0125
TEA TIME TEA TOWELS,386,0.0125
PAPER BUNTING VINTAGE PAISLEY,386,0.0125
SET OF 12 FAIRY CAKE BAKING CASES,385,0.0125
MAGIC DRAWING SLATE SPACEBOY,385,0.0125
CHRISTMAS STAR WISH LIST CHALKBOARD,385,0.0125
GIN & TONIC DIET GREETING CARD,385,0.0125
RED RETROSPOT WRAP,384,0.0125
RED 3 PIECE MINI DOTS CUTLERY SET,384,0.0125
COFFEE MUG DOG + BALL DESIGN,384,0.0125
PACK OF 20 SKULL PAPER NAPKINS,383,0.0124
WRAP ENGLISH ROSE,383,0.0124
DOORMAT FAIRY CAKE,382,0.0124
CERAMIC CAKE DESIGN SPOTTED MUG,382,0.0124
SET OF 9 HEART SHAPED BALLOONS,379,0.0123
RED RETROSPOT BUTTER DISH,379,0.0123
CHRISTMAS TOILET ROLL,379,0.0123
WRAP PINK FAIRY CAKES,378,0.0123
ENGLISH ROSE HOT WATER BOTTLE,378,0.0123
SET OF 72 RETROSPOT PAPER  DOILIES,378,0.0123
GINGHAM HEART DECORATION,377,0.0122
CARD HOLDER GINGHAM HEART,377,0.0122
TOY TIDY PINK RETROSPOT,376,0.0122
RED SPOT HEART HOT WATER BOTTLE,375,0.0122
FELTCRAFT PRINCESS OLIVIA DOLL,374,0.0121
DELUXE SEWING KIT,373,0.0121
SPACEBOY GIFT WRAP,373,0.0121
FULL ENGLISH BREAKFAST PLATE,372,0.0121
NOEL WOODEN BLOCK LETTERS,371,0.012
BLUE 3 PIECE MINI DOTS CUTLERY SET,371,0.012
S/6 WOODEN SKITTLES IN COTTON BAG,371,0.012
RED SPOTTY ROUND CAKE TINS,371,0.012
CHRISTMAS LIGHTS 10 REINDEER,370,0.012
SET OF 3 WOODEN HEART DECORATIONS,370,0.012
BROCADE RING PURSE,370,0.012
HANGING METAL STAR LANTERN,369,0.012
36 PENCILS TUBE SKULLS,369,0.012
VINTAGE KID DOLLY CARD,369,0.012
GROW YOUR OWN BASIL IN ENAMEL MUG,368,0.012
SLATE TILE NATURAL HANGING,367,0.0119
SMALL PURPLE BABUSHKA NOTEBOOK,366,0.0119
JUMBO BAG VINTAGE CHRISTMAS,365,0.0119
ASSTD DESIGN BUBBLE GUM RING,365,0.0119
12 PENCILS TALL TUBE WOODLAND,364,0.0118
SWEETHEART RECIPE BOOK STAND,363,0.0118
JAZZ HEARTS PURSE NOTEBOOK,363,0.0118
KINGS CHOICE TEA CADDY,362,0.0118
HAND WARMER RED LOVE HEART,360,0.0117
FAIRY CAKE FLANNEL ASSORTED COLOUR,360,0.0117
COFFEE MUG APPLES DESIGN,360,0.0117
LARGE POPCORN HOLDER,360,0.0117
DINOSAURS  WRITING SET,358,0.0116
20 DOLLY PEGS RETROSPOT,358,0.0116
STRAWBERRY FAIRY CAKE TEAPOT,358,0.0116
ALARM CLOCK BAKELIKE CHOCOLATE,357,0.0116
CERAMIC CAKE STAND + HANGING CAKES,357,0.0116
FOLKART ZINC HEART CHRISTMAS DEC,357,0.0116
CALENDAR PAPER CUT DESIGN,356,0.0116
CLEAR DRAWER KNOB ACRYLIC EDWARDIAN,355,0.0115
BALLOONS  WRITING SET,354,0.0115
HEADS AND TAILS SPORTING FUN,354,0.0115
SET OF 72 RETRO SPOT PAPER  DOILIES,353,0.0115
RIBBON REEL CHRISTMAS PRESENT,353,0.0115
DOORMAT HOME SWEET HOME BLUE,352,0.0114
RETROSPOT LARGE MILK JUG,352,0.0114
FUNKY WASHING UP GLOVES ASSORTED,351,0.0114
TOY TIDY PINK POLKADOT,351,0.0114
CHILDS BREAKFAST SET SPACEBOY,349,0.0113
SET 12 KIDS  WHITE CHALK STICKS,349,0.0113
MINI WOODEN HAPPY BIRTHDAY GARLAND,348,0.0113
FANNY'S REST STOPMETAL SIGN,348,0.0113
CHILDS BREAKFAST SET DOLLY GIRL,347,0.0113
CHILDS BREAKFAST SET CIRCUS PARADE,346,0.0112
"ELEPHANT, BIRTHDAY CARD,",346,0.0112
COSY HOUR CIGAR BOX MATCHES,346,0.0112
PINK 3 PIECE MINI DOTS CUTLERY SET,346,0.0112
RED SPOTTY SHOPPER BAG,345,0.0112
VINTAGE UNION JACK DOORSTOP,345,0.0112
RED RETROSPOT UMBRELLA,345,0.0112
SMALL RED BABUSHKA NOTEBOOK,344,0.0112
BREAD BIN DINER STYLE IVORY,343,0.0111
SET/6 TURQUOISE BUTTERFLY T-LIGHTS,343,0.0111
VICTORIAN  METAL POSTCARD SPRING,343,0.0111
VINTAGE CHRISTMAS BUNTING,343,0.0111
NO JUNK MAIL METAL SIGN,341,0.0111
METAL SIGN EMPIRE TEA,340,0.011
PACK OF 12 SKULL TISSUES,339,0.011
CHARLOTTE BAG APPLES DESIGN,338,0.011
MONSTERS STENCIL CRAFT,338,0.011
FINE WICKER HEART,337,0.0109
RIBBON REEL CHRISTMAS SOCK BAUBLE,336,0.0109
WATERING CAN PINK BUNNY,334,0.0108
POLYESTER FILLER PAD 40X40CM,334,0.0108
SOLDIERS EGG CUP,333,0.0108
SET/10 RED POLKADOT PARTY CANDLES,333,0.0108
CLASSIC METAL BIRDCAGE PLANT HOLDER,331,0.0107
CHARLIE+LOLA PINK HOT WATER BOTTLE,331,0.0107
BRIGHT BLUES RIBBONS,330,0.0107
12 MESSAGE CARDS WITH ENVELOPES,330,0.0107
CAKE STAND 3 TIER MAGIC GARDEN,329,0.0107
SKULL SHOULDER BAG,329,0.0107
SWEETHEART KEY CABINET,328,0.0107
ADVENT CALENDAR GINGHAM SACK,328,0.0107
DOORMAT WELCOME PUPPIES,327,0.0106
HOT WATER BOTTLE BABUSHKA,327,0.0106
SKULLS WRITING SET,326,0.0106
VINTAGE CREAM DOG FOOD CONTAINER,326,0.0106
DOOR MAT RED SPOT,325,0.0106
SKULLS  WATER TRANSFER TATTOOS,325,0.0106
RIBBON REEL LACE DESIGN,325,0.0106
PINK FAIRY CAKE CHILD'S APRON,325,0.0106
BOX OF 6 MINI 50'S CRACKERS,324,0.0105
RED/WHITE DOTS RUFFLED UMBRELLA,324,0.0105
MAN FLU METAL SIGN,324,0.0105
RIBBON REEL SNOWY VILLAGE,324,0.0105
ROSE CARAVAN DOORSTOP,324,0.0105
PAINT YOUR OWN CANVAS SET,324,0.0105
WHITE JEWELLED HEART DECORATION,323,0.0105
HOME SMALL WOOD LETTERS,322,0.0105
PARTY CONE CHRISTMAS DECORATION,321,0.0104
VICTORIAN SEWING BOX MEDIUM,320,0.0104
ROCKING HORSE RED CHRISTMAS,320,0.0104
PACK OF 12 COLOURED PENCILS,320,0.0104
HEART DECORATION PAINTED ZINC,320,0.0104
MAGNETS PACK OF 4 SWALLOWS,319,0.0104
ROUND CONTAINER SET OF 5 RETROSPOT,318,0.0103
BROWN CHECK CAT DOORSTOP,318,0.0103
KINGS CHOICE MUG,318,0.0103
PEACE WOODEN BLOCK LETTERS,317,0.0103
POLYESTER FILLER PAD 45X45CM,317,0.0103
MAGIC DRAWING SLATE DOLLY GIRL,317,0.0103
SET OF TEA COFFEE SUGAR TINS PANTRY,316,0.0103
RED SPOTS  WRAP,316,0.0103
PINK BABY BUNTING,316,0.0103
PLAYING CARDS KEEP CALM & CARRY ON,316,0.0103
CITRONELLA CANDLE FLOWERPOT,315,0.0102
T-LIGHT GLASS FLUTED ANTIQUE,315,0.0102
CITRONELLA CANDLE GARDEN POT,315,0.0102
PACK OF 12 PINK PAISLEY TISSUES,314,0.0102
ROUND CAKE TIN VINTAGE RED,314,0.0102
RETRO COFFEE MUGS ASSORTED,314,0.0102
CARD BILLBOARD FONT,314,0.0102
SMALL HEART FLOWERS HOOK,314,0.0102
SET/10 PINK SPOTTY PARTY CANDLES,313,0.0102
WATERING CAN GREEN DINOSAUR,313,0.0102
DOORMAT UNION JACK GUNS AND ROSES,312,0.0101
GLASS  BEURRE DISH,312,0.0101
WOODEN BOX ADVENT CALENDAR,312,0.0101
MOROCCAN TEA GLASS,312,0.0101
GARLAND WOODEN HAPPY EASTER,311,0.0101
VINTAGE DOILY TRAVEL SEWING KIT,310,0.0101
RETROSPOT RED WASHING UP GLOVES,310,0.0101
CHRISTMAS PUDDING TRINKET POT,309,0.01
RED RETROSPOT MINI CASES,309,0.01
VICTORIAN SEWING BOX LARGE,309,0.01
CIRCUS PARADE LUNCH BOX,309,0.01
PACK 3 BOXES CHRISTMAS PANNETONE,309,0.01
CHRISTMAS RETROSPOT STAR WOOD,308,0.01
PANTRY MAGNETIC  SHOPPING LIST,308,0.01
WOODEN SKITTLES GARDEN SET,308,0.01
PACK OF 20 NAPKINS RED APPLES,308,0.01
DOORMAT 3 SMILEY CATS,307,0.01
SMALL YELLOW BABUSHKA NOTEBOOK,307,0.01
SLEEPING CAT ERASERS,307,0.01
